{
  "version": 1,
  "case_id": "n31_media_change",
  "run_id": "dgx-visual-2026-07-17T022400.483802+0000",
  "generated_at": "2026-07-17T02:24:00.483802+00:00",
  "status": "COMPLETED",
  "processing_location": "DGX_SPARK_LOCAL",
  "backend": "CUDA_NATIVE",
  "actual_gpu_compute": true,
  "semantic_claim_scope": "CANDIDATE_SELECTION_ONLY",
  "source_policy": {
    "external_api_processing_authorized": false,
    "dgx_processing_authorized": true,
    "accepted_privacy_status": "LOCAL_QA_PASSED",
    "processed_source_count": 6,
    "excluded_source_count": 2,
    "third_party_reference_processed": false
  },
  "gpu": {
    "device_name": "NVIDIA GB10",
    "compute_capability": "12.1",
    "cuda_runtime": "13.0",
    "compiled_arch": "sm_121",
    "total_global_memory_bytes": 128524251136
  },
  "configuration": {
    "sample_interval_seconds": 1.0,
    "resize_width": 320,
    "scene_change_threshold": 0.08,
    "selected_frame_limit": 12,
    "timestamp_basis": "FFMPEG_SHOWINFO_PTS"
  },
  "sources": [
    {
      "source_id": "N31_VIDEO_OPERATION_FULL",
      "sha256": "ae9c2b9b524c928a036373a0927546a972be46d0419453a953510c33f4d1510b",
      "duration_ms": 327400,
      "sampled_frame_count": 327,
      "gpu_kernel_ms": 42.692905,
      "selected_frames": [
        {
          "frame_index": 1,
          "timestamp_ms": 0,
          "scene_change_score": 0.0,
          "mean_luma": 111.068993,
          "contrast": 53.222716,
          "edge_energy": 5.220026,
          "selection_reason": "BOUNDARY_FIRST"
        },
        {
          "frame_index": 42,
          "timestamp_ms": 41000,
          "scene_change_score": 0.137366,
          "mean_luma": 109.719444,
          "contrast": 50.966149,
          "edge_energy": 4.749128,
          "selection_reason": "SCENE_CHANGE"
        },
        {
          "frame_index": 45,
          "timestamp_ms": 44000,
          "scene_change_score": 0.100747,
          "mean_luma": 110.731024,
          "contrast": 52.520221,
          "edge_energy": 5.067986,
          "selection_reason": "SCENE_CHANGE"
        },
        {
          "frame_index": 63,
          "timestamp_ms": 62000,
          "scene_change_score": 0.111745,
          "mean_luma": 95.964115,
          "contrast": 50.653524,
          "edge_energy": 5.279922,
          "selection_reason": "SCENE_CHANGE"
        },
        {
          "frame_index": 64,
          "timestamp_ms": 63000,
          "scene_change_score": 0.106053,
          "mean_luma": 102.313559,
          "contrast": 50.327441,
          "edge_energy": 6.131866,
          "selection_reason": "SCENE_CHANGE"
        },
        {
          "frame_index": 68,
          "timestamp_ms": 67000,
          "scene_change_score": 0.130412,
          "mean_luma": 109.091615,
          "contrast": 52.573119,
          "edge_energy": 5.093601,
          "selection_reason": "SCENE_CHANGE"
        },
        {
          "frame_index": 96,
          "timestamp_ms": 95000,
          "scene_change_score": 0.134988,
          "mean_luma": 99.327743,
          "contrast": 50.198324,
          "edge_energy": 5.86313,
          "selection_reason": "SCENE_CHANGE"
        },
        {
          "frame_index": 135,
          "timestamp_ms": 134000,
          "scene_change_score": 0.115297,
          "mean_luma": 106.52809,
          "contrast": 55.498993,
          "edge_energy": 5.036548,
          "selection_reason": "SCENE_CHANGE"
        },
        {
          "frame_index": 153,
          "timestamp_ms": 152000,
          "scene_change_score": 0.105527,
          "mean_luma": 102.11066,
          "contrast": 51.136345,
          "edge_energy": 5.243993,
          "selection_reason": "SCENE_CHANGE"
        },
        {
          "frame_index": 179,
          "timestamp_ms": 178000,
          "scene_change_score": 0.123805,
          "mean_luma": 107.397622,
          "contrast": 57.128666,
          "edge_energy": 4.709058,
          "selection_reason": "SCENE_CHANGE"
        },
        {
          "frame_index": 304,
          "timestamp_ms": 303000,
          "scene_change_score": 0.138395,
          "mean_luma": 76.203802,
          "contrast": 66.078955,
          "edge_energy": 3.848431,
          "selection_reason": "SCENE_CHANGE"
        },
        {
          "frame_index": 327,
          "timestamp_ms": 326000,
          "scene_change_score": 0.00272,
          "mean_luma": 71.853767,
          "contrast": 64.122011,
          "edge_energy": 3.738666,
          "selection_reason": "BOUNDARY_LAST"
        }
      ]
    },
    {
      "source_id": "N31_VIDEO_MEDIA_TYPE",
      "sha256": "b7068a0db31704aeffb564793dfd80809485f4884cb0aea82cda8a1894be8a31",
      "duration_ms": 13000,
      "sampled_frame_count": 13,
      "gpu_kernel_ms": 1.752832,
      "selected_frames": [
        {
          "frame_index": 1,
          "timestamp_ms": 0,
          "scene_change_score": 0.0,
          "mean_luma": 113.905347,
          "contrast": 53.584134,
          "edge_energy": 3.590907,
          "selection_reason": "BOUNDARY_FIRST"
        },
        {
          "frame_index": 7,
          "timestamp_ms": 6000,
          "scene_change_score": 0.081579,
          "mean_luma": 117.487743,
          "contrast": 56.101916,
          "edge_energy": 2.828945,
          "selection_reason": "SCENE_CHANGE"
        },
        {
          "frame_index": 9,
          "timestamp_ms": 8000,
          "scene_change_score": 0.158951,
          "mean_luma": 114.562639,
          "contrast": 55.487756,
          "edge_energy": 1.818779,
          "selection_reason": "SCENE_CHANGE"
        },
        {
          "frame_index": 10,
          "timestamp_ms": 9000,
          "scene_change_score": 0.171769,
          "mean_luma": 128.281389,
          "contrast": 50.081743,
          "edge_energy": 2.803679,
          "selection_reason": "SCENE_CHANGE"
        },
        {
          "frame_index": 13,
          "timestamp_ms": 12000,
          "scene_change_score": 0.054183,
          "mean_luma": 127.867691,
          "contrast": 51.157892,
          "edge_energy": 2.53143,
          "selection_reason": "BOUNDARY_LAST"
        }
      ]
    },
    {
      "source_id": "N31_VIDEO_GUIDES",
      "sha256": "5343b2e177174e37ccd859368a07c45f710a11a43c51bfceca5ddd53f7c5a9cf",
      "duration_ms": 37600,
      "sampled_frame_count": 38,
      "gpu_kernel_ms": 4.999872,
      "selected_frames": [
        {
          "frame_index": 1,
          "timestamp_ms": 0,
          "scene_change_score": 0.0,
          "mean_luma": 103.541024,
          "contrast": 55.43724,
          "edge_energy": 4.671822,
          "selection_reason": "BOUNDARY_FIRST"
        },
        {
          "frame_index": 6,
          "timestamp_ms": 5000,
          "scene_change_score": 0.264277,
          "mean_luma": 112.348733,
          "contrast": 61.155837,
          "edge_energy": 6.205711,
          "selection_reason": "SCENE_CHANGE"
        },
        {
          "frame_index": 7,
          "timestamp_ms": 6000,
          "scene_change_score": 0.156428,
          "mean_luma": 124.067795,
          "contrast": 54.921395,
          "edge_energy": 6.915397,
          "selection_reason": "SCENE_CHANGE"
        },
        {
          "frame_index": 20,
          "timestamp_ms": 19000,
          "scene_change_score": 0.163511,
          "mean_luma": 121.383247,
          "contrast": 56.892803,
          "edge_energy": 5.392729,
          "selection_reason": "SCENE_CHANGE"
        },
        {
          "frame_index": 21,
          "timestamp_ms": 20000,
          "scene_change_score": 0.09574,
          "mean_luma": 119.125035,
          "contrast": 58.001368,
          "edge_energy": 5.178344,
          "selection_reason": "SCENE_CHANGE"
        },
        {
          "frame_index": 22,
          "timestamp_ms": 21000,
          "scene_change_score": 0.170815,
          "mean_luma": 111.805885,
          "contrast": 59.547563,
          "edge_energy": 6.189032,
          "selection_reason": "SCENE_CHANGE"
        },
        {
          "frame_index": 23,
          "timestamp_ms": 22000,
          "scene_change_score": 0.137384,
          "mean_luma": 107.278142,
          "contrast": 56.166312,
          "edge_energy": 6.963557,
          "selection_reason": "SCENE_CHANGE"
        },
        {
          "frame_index": 24,
          "timestamp_ms": 23000,
          "scene_change_score": 0.119377,
          "mean_luma": 121.055937,
          "contrast": 53.544293,
          "edge_energy": 6.4149,
          "selection_reason": "SCENE_CHANGE"
        },
        {
          "frame_index": 25,
          "timestamp_ms": 24000,
          "scene_change_score": 0.109015,
          "mean_luma": 115.478212,
          "contrast": 53.150966,
          "edge_energy": 5.859956,
          "selection_reason": "SCENE_CHANGE"
        },
        {
          "frame_index": 34,
          "timestamp_ms": 33000,
          "scene_change_score": 0.1861,
          "mean_luma": 127.798385,
          "contrast": 56.812495,
          "edge_energy": 5.405109,
          "selection_reason": "SCENE_CHANGE"
        },
        {
          "frame_index": 35,
          "timestamp_ms": 34000,
          "scene_change_score": 0.13114,
          "mean_luma": 109.012882,
          "contrast": 55.278449,
          "edge_energy": 5.12095,
          "selection_reason": "SCENE_CHANGE"
        },
        {
          "frame_index": 38,
          "timestamp_ms": 37000,
          "scene_change_score": 0.078362,
          "mean_luma": 107.049618,
          "contrast": 54.5045,
          "edge_energy": 4.365955,
          "selection_reason": "BOUNDARY_LAST"
        }
      ]
    },
    {
      "source_id": "N31_VIDEO_LEARNING",
      "sha256": "efccdc08963c11df93ef518146ea5dfcc9900848847edb0c8beb0a661c260741",
      "duration_ms": 9870,
      "sampled_frame_count": 10,
      "gpu_kernel_ms": 1.345632,
      "selected_frames": [
        {
          "frame_index": 1,